review,reference,duplicate,occurence,id
Kozyreva_2024,"Ecker, U. K. H., O’Reilly, Z., Reid, J. S., & Chang, E. P. (2020). The effectiveness of short-format refutational fact-checks. The British Journal of Psychology, 111, 36-54.",NA,NA,111
Kozyreva_2024,"Grady, R. H., Ditto, P. H., & Loftus, E. F. (2021). Nevertheless, partisanship persisted: Fake news warnings help briefly, but bias returns with time. Cognitive Research: Principles and Implications, 6(1), Article 52.",NA,NA,112
Kozyreva_2024,"Lee, J., Kim, J. W., & Yun Lee, H. (2023). Unlocking Conspiracy Belief Systems: How Fact-Checking Label on Twitter Counters Conspiratorial MMR Vaccine Misinformation. Health 
Communication, 38(9), 1780-1792.",NA,NA,113
Kozyreva_2024,"Koch, T. K., Frischlich, L., & Lermer, E. (2023). Effects of fact‐checking warning labels and social endorsement cues on climate change fake news credibility and engagement on social media. Journal of Applied Social Psychology, 53(6): 495-507.",NA,NA,114
Kozyreva_2024,"Moon, W.-K., Chung, M., & Jones-Jang, S. Mo. (2022). How Can We Fight Partisan Biases in the COVID-19 Pandemic? AI Source Labels on Fact-checking Messages Reduce Motivated Reasoning.
Mass Communication and Society, 26(4): 646-670.",NA,NA,115
Sun_2025,Disentangling Item and Testing Effects in Inoculation Research on Online Misinformation: Solomon Revisited,NA,NA,116
Sun_2025,The Spot the Troll Quiz game increases accuracy in discerning between real and i/uthentic social media accounts,NA,NA,117
Sun_2025,Psychological inoculation strategies to fight climate disinformation across 12 countries,NA,NA,118
Sun_2025,Mixed News about the Bad News Game,NA,NA,119
Sun_2025,A Health Media Literacy Intervention Increases Skepticism of Both I/ccurate and Accurate Cancer News Among U.S. Adults,NA,NA,120
Sun_2025,Prominent misinformation interventions reduce misperceptions but increase scepticism,NA,NA,121
Sun_2025,Strategies to combat misinformation: Enduring effects of a 15-minute online intervention on critical-thinking adolescents,NA,NA,122
Sun_2025,Feedback exercises boost discernment of misinformation for gamified inoculation interventions,NA,NA,123
Sun_2025,Critical thinking and misinformation vulnerability: experimental evidence from Colombia,NA,NA,124
Sun_2025,Is the COVID-19 bad news game good news? Testing whether creating and dissemi/ting fake news about vaccines in a computer game reduces people's belief in anti-vaccine arguments,NA,NA,125
